,0,1,2
0,"In caso di foratura di un pneumatico, lo sterzo tira nella direzione opposta a quella della ruota forata",FALSO,25396
1,Se lo sterzo vibra si deve far controllare la bilanciatura delle ruote posteriori,FALSO,25397
2,La rottura del servosterzo si manifesta con un'eccessiva facilità di manovra dello sterzo,FALSO,25398
3,"Il volante deve essere impugnato nella sua parte bassa, con entrambe le mani sotto le razze",FALSO,25399
4,Il volante non può essere regolato in altezza,FALSO,25400
5,La precisione della sterzata non Ł influenzata dalle cattive condizioni delle sospensioni e degli ammortizzatori,FALSO,25401
6,La precisione della sterzata Ł influenzata dalla scarsa pressione dell'olio di lubrificazione,FALSO,25402
7,La precisione della sterzata Ł influenzata dall'eccessiva temperatura del liquido di raffreddamento,FALSO,25403
